Symbol,Name,Last Sale,Net Change,% Change,Market Cap,Country,IPO Year,Volume,Sector,Industry
PSA^I,Public Storage Depositary Shares Each Representing 1/1000 of a 4.875% Cumulative Preferred Share of Beneficial Interest Series I par value $0.01 per share,$26.9172,0.1172,0.437%,,United States,,39592,,
PSA^J,Public Storage Depositary Shares Each Representing 1/1000 of a 4.700% Cumulative Preferred Share of Beneficial Interest Series J par value $0.01 per share,$26.57,0.0601,0.227%,,United States,,6418,,
PSA^K,Public Storage Depositary Shares Each Representing 1/1000 of a 4.75% Cumulative Preferred Share of Beneficial Interest Series K,$27.32,-0.01,-0.037%,,United States,,11085,Consumer Services,Real Estate Investment Trusts
PSA^L,Public Storage Depositary Shares Each Representing 1/1000 of a 4.625% Cumulative Preferred Share of Beneficial Interest Series L par value $0.01 per share,$26.4624,0.1024,0.388%,,United States,,32167,Consumer Services,Real Estate Investment Trusts
PSA^M,Public Storage Depositary Shares Each Representing 1/1000 of a 4.125% Cumulative Preferred Share of Beneficial Interest Series M,$26.34,0.21,0.804%,,United States,,19799,,
PSA^N,Public Storage Depositary Shares Each Representing 1/1000 of a 3.875% Cumulative Preferred Share of Beneficial Interest Series N,$25.20,-0.06,-0.238%,,United States,,36891,,
PSA^O,Public Storage Depositary Shares Each Representing 1/1000 of a 3.900% Cumulative Preferred Share of Beneficial Interest Series O,$25.53,-0.05,-0.195%,,United States,,27782,,
PSB,PS Business Parks Inc. Common Stock,$141.81,0.84,0.596%,3898150850.00,United States,,37015,Consumer Services,Real Estate Investment Trusts
PSB^W,PS Business Parks Inc. Depositary Shares Each Representing 1/1000 of a Share of 5.20% Cumulative Preferred Stock Series W,$25.75,-0.09,-0.348%,,United States,,2811,,
PSB^X,PS Business Parks Inc. Depositary Shares Each Representing 1/1000 of a Share of 5.25% Cumulative Preferred Stock Series X,$26.345,0.025,0.095%,,United States,,10955,,
PSB^Y,PS Business Parks Inc. 5.20% Cumulative Preferred Stock Series Y,$26.25,-0.04,-0.152%,,United States,,4024,,
PSB^Z,PS Business Parks Inc. Depositary Shares Each Representing 1/1000 of a Share of 4.875% Cumulative Preferred Stock Series Z  par value $0.01 per share,$26.48,0.02,0.076%,,United States,,11429,,
PSF,Cohen & Steers Select Preferred and Income Fund Inc. Common Stock,$27.13,0.21,0.78%,325900129.00,,2010,38704,,
PSN,Parsons Corporation Common Stock,$38.10,0.54,1.438%,3837703234.00,,2019,427442,Technology,EDP Services
PSO,Pearson Plc Common Stock,$9.95,-0.15,-1.485%,7499199769.00,United Kingdom,,364575,Consumer Services,Books
PSTG,Pure Storage Inc. Class A Common Stock,$27.05,0.15,0.558%,7379537252.00,,2015,6605850,Technology,Electronic Components
PSTH,Pershing Square Tontine Holdings Ltd. Class A Common Stock,$30.00,0.35,1.18%,6000003000.00,,2020,2770172,Finance,Business Services
PSTL,Postal Realty Trust Inc. Class A Common Stock,$16.19,0.20,1.251%,213935599.00,,2019,112416,Consumer Services,Real Estate Investment Trusts
PSX,Phillips 66 Common Stock,$72.04,0.11,0.153%,31467085327.00,United States,,2300246,Energy,Integrated oil Companies
PSXP,Phillips 66 Partners LP Common Units representing limited partner interest in the Partnership,$25.15,-0.05,-0.198%,5742754672.00,United States,2013,761139,Energy,Natural Gas Distribution
PTA,Cohen & Steers Tax-Advantaged Preferred Securities and Income Fund Common Shares of Beneficial Interest,$25.34,0.04,0.158%,0.00,,2020,53100,,
PTR,PetroChina Company Limited Common Stock,$31.11,0.00,0.00%,56937826194.00,China,,93788,Energy,Oil & Gas Production
PTY,Pimco Corporate & Income Opportunity Fund,$18.04,0.06,0.334%,1915869919.00,United States,2002,361412,,
PUK,Prudential Public Limited Company Common Stock,$33.52,-0.37,-1.092%,43735518797.00,United Kingdom,,590799,Finance,Life Insurance
PUK^,Prudential Public Limited Company 6.75% Perpetual Subordinated Captial Security,$26.52,-0.15,-0.562%,,United Kingdom,,19634,,
PUK^A,Prudential Public Limited Company 6.50% Perpetual Subordinated Capital Securities Exchangeable at the Issuer's Option Into Non-Cumulative Dollar Denominated Preference Shares,$26.39,0.09,0.342%,,United Kingdom,,28990,,
PUMP,ProPetro Holding Corp. Common Stock,$9.50,0.72,8.20%,958671382.00,United States,2017,2231598,Energy,Oilfield Services/Equipment
PVG,Pretium Resources Inc. Ordinary Shares (Canada),$11.07,0.10,0.912%,2072898935.00,Canada,,1172424,Basic Industries,Precious Metals
PVH,PVH Corp. Common Stock,$95.19,2.58,2.786%,6768032798.00,United States,,749913,Consumer Non-Durables,Apparel
PVL,Permianville Royalty Trust Trust Units ,$1.29,0.09,7.50%,42570000.00,United States,2011,670347,Energy,Oil & Gas Production
PWR,Quanta Services Inc. Common Stock,$75.95,0.64,0.85%,10546485355.00,United States,,686231,Capital Goods,Engineering & Construction
PXD,Pioneer Natural Resources Company Common Stock,$128.24,1.64,1.295%,27726396709.00,United States,,1998546,Energy,Oil & Gas Production
PYN,PIMCO New York Municipal Income Fund III Common Shares of Beneficial Interest,$9.17,0.03,0.328%,52526594.00,United States,2002,22878,,
PYS,Merrill Lynch Depositor Inc PPlus Tr Ser RRD-1 Tr Ctf Cl A,$21.50,0.06,0.28%,0.00,United States,,5555,Finance,Finance: Consumer Services
PYT,PPlus Tr GSC-2 Tr Ctf Fltg Rate,$24.25,-0.05,-0.206%,0.00,United States,,6100,Finance,Finance: Consumer Services
PZC,PIMCO California Municipal Income Fund III Common Shares of Beneficial Interest,$10.50,-0.02,-0.19%,234924228.00,United States,2002,51531,,
PZN,Pzena Investment Management Inc Class A Common Stock,$9.18,0.34,3.846%,653340297.00,United States,2007,62839,Finance,Investment Managers
QD,Qudian Inc. American Depositary Shares each representing one Class A Ordinary Share,$3.00,0.32,11.94%,761188047.00,China,2017,12694120,Finance,Finance: Consumer Services
QEP,QEP Resources Inc. Common Stock,$3.18,-0.05,-1.548%,772535335.00,United States,,3196190,Energy,Oil & Gas Production
QGEN,Qiagen N.V. Common Shares ,$54.03,-0.64,-1.171%,12359308470.00,Netherlands,,721166,Health Care,Biotechnology: Biological Products (No Diagnostic Substances)
QS,QuantumScape Corporation Class A Common Stock,$44.90,-2.49,-5.254%,16341817650.00,United States,2020,10226141,Miscellaneous,Industrial Machinery/Components
QSR,Restaurant Brands International Inc. Common Shares,$59.61,0.06,0.101%,18068581369.00,Canada,2014,1076352,Consumer Services,Restaurants
QTS,QTS Realty Trust Inc. Class A Common Stock,$65.77,0.54,0.828%,4237923098.00,United States,2013,573441,Consumer Services,Real Estate Investment Trusts
QTS^A,QTS Realty Trust Inc. 7.125% Series A Cumulative Redeemable Perpetual Preferred Stock,$27.248,0.258,0.956%,,United States,,1996,,
QTS^B,QTS Realty Trust Inc. 6.50% Series B Cumulative Convertible Perpetual Preferred Stock,$147.74,0.24,0.163%,,United States,,649,,
QTWO,Q2 Holdings Inc. Common Stock,$142.57,4.33,3.132%,7682123404.00,,2014,598856,Technology,Computer Software: Prepackaged Software
QUAD,Quad Graphics Inc Class A Common Stock,$5.72,0.22,4.00%,306915237.00,United States,,208690,Miscellaneous,Publishing
QUOT,Quotient Technology Inc. Common Stock,$9.89,0.19,1.959%,900044969.00,,2014,372043,Consumer Services,Advertising
QVCC,QVC Inc. 6.250% Senior Secured Notes due 2068,$25.22,-0.13,-0.513%,0.00,United States,2019,41021,Consumer Services,Catalog/Specialty Distribution
QVCD,QVC Inc. 6.375% Senior Secured Notes due 2067,$25.58,-0.25,-0.968%,0.00,United States,2018,30198,Consumer Services,Catalog/Specialty Distribution
R,Ryder System Inc. Common Stock,$67.25,-0.32,-0.474%,3624043522.00,United States,,238650,Consumer Services,Rental/Leasing Companies
RA,Brookfield Real Assets Income Fund Inc. Common Stock,$19.45,0.49,2.584%,853666588.00,,2016,408747,,
RACE,Ferrari N.V. Common Shares,$202.68,1.35,0.671%,50283856496.00,,2015,214451,Capital Goods,Auto Manufacturing
RAD,Rite Aid Corporation Common Stock,$23.59,-0.56,-2.319%,1302742723.00,United States,,1621966,Health Care,Medical/Nursing Services
RAMP,LiveRamp Holdings Inc. Common Stock,$82.01,2.17,2.718%,5438292472.00,United States,2018,953812,Technology,EDP Services
RBA,Ritchie Bros. Auctioneers Incorporated Common Stock,$59.01,0.49,0.837%,6474124121.00,Canada,,1061502,Miscellaneous,Business Services
RBAC,RedBall Acquisition Corp. Class A Ordinary Shares,$10.59,-0.10,-0.935%,761156250.00,United States,2020,861042,Finance,Business Services
RBC,Regal Beloit Corporation Common Stock,$131.38,2.04,1.577%,5333408149.00,United States,,187348,Consumer Durables,Metal Fabrications
RC,Ready Capital Corproation Common Stock,$12.60,0.08,0.639%,686278921.00,United States,2013,650624,Consumer Services,Real Estate Investment Trusts
RCA,Ready Capital Corporation 7.00% Convertible Senior Notes due 2023,$24.30,0.28,1.166%,0.00,United States,2017,315702,Consumer Services,Real Estate Investment Trusts
RCB,Ready Capital Corporation 6.20% Senior Notes due 2026,$25.16,-0.27,-1.062%,0.00,United States,2019,1255,Consumer Services,Real Estate Investment Trusts
RCI,Rogers Communication Inc. Common Stock,$46.36,0.02,0.043%,23408337742.00,Canada,,424859,Consumer Services,Television Services
RCL,D/B/A Royal Caribbean Cruises Ltd. Common Stock,$71.58,0.74,1.045%,16992035909.00,United States,1993,3038527,Consumer Services,Marine Transportation
RCP,Ready Capital Corporation 6.50% Senior Notes due 2021,$25.17,0.00,0.00%,0.00,United States,2018,2482,Consumer Services,Real Estate Investment Trusts
RCS,PIMCO Strategic Income Fund Inc.,$7.09,-0.03,-0.421%,311506240.00,United States,1994,182625,,
RCUS,Arcus Biosciences Inc. Common Stock,$40.50,1.01,2.558%,2629393812.00,,2018,422058,Health Care,Major Pharmaceuticals
RDN,Radian Group Inc. Common Stock,$20.17,0.06,0.298%,3863695977.00,United States,,1097351,Finance,Property-Casualty Insurers
RDS/B,Royal Dutch Shell PLC,$35.27,0.82,2.38%,,Netherlands,,2121790,,
RDY,Dr. Reddy's Laboratories Ltd Common Stock,$65.59,2.08,3.275%,10882368917.00,India,,398908,Health Care,Major Pharmaceuticals
RE,Everest Re Group Ltd. Common Stock,$219.40,-1.53,-0.693%,8768468656.00,Bermuda,,201383,Finance,Property-Casualty Insurers
RELX,RELX PLC PLC American Depositary Shares (Each representing One Ordinary Share),$25.19,-0.30,-1.177%,48675206319.00,United Kingdom,2015,598800,Miscellaneous,Business Services
RENN,Renren Inc. American Depositary Shares each representing fifteen Class A ordinary shares,$7.74,0.05,0.65%,182507977.00,China,2011,188576,Consumer Durables,Automotive Aftermarket
RES,RPC Inc. Common Stock,$5.12,0.13,2.605%,1101145974.00,United States,,720320,Energy,Oilfield Services/Equipment
REV,Revlon Inc. New Common Stock,$11.41,-0.03,-0.262%,608530374.00,United States,1996,202829,Consumer Non-Durables,Package Goods/Cosmetics
REVG,REV Group Inc. Common Stock,$11.16,0.15,1.362%,712171349.00,United States,2017,128777,Capital Goods,Auto Manufacturing
REX,REX American Resources Corporation,$85.08,0.66,0.782%,509799530.00,United States,,14627,Basic Industries,Major Chemicals
REXR,Rexford Industrial Realty Inc. Common Stock,$50.00,0.35,0.705%,6526275050.00,United States,2013,419773,Consumer Services,Real Estate Investment Trusts
REXR^A,Rexford Industrial Realty Inc. 5.875% Series A Cumulative Redeemable Preferred Stock,$25.40,0.01,0.039%,,United States,,3642,,
REXR^B,Rexford Industrial Realty Inc. 5.875% Series B Cumulative Redeemable Preferred Stock,$26.93,0.105,0.391%,,United States,,2983,,
REXR^C,Rexford Industrial Realty Inc. 5.625% Series C Cumulative Redeemable Preferred Stock par value $0.01 per share,$26.6402,-0.3198,-1.186%,,United States,,3076,,
REZI,Resideo Technologies Inc. Common Stock ,$25.03,0.26,1.05%,3580414323.00,,2018,607363,Capital Goods,Wholesale Distributors
RF,Regions Financial Corporation Common Stock,$18.93,-0.05,-0.263%,18181202516.00,United States,,6504754,Finance,Major Banks
RF^A,Regions Financial Corporation Depositary Shares Representing 1/40th Perpetual Preferred Series A,$25.97,-0.11,-0.422%,,United States,,37395,,
RF^B,Regions Financial Corporation Depositary Shares Representing 1/40th Perpetual Preferred Series B,$29.20,0.06,0.206%,,United States,,39302,,
RF^C,Regions Financial Corporation Depositary Shares each Representing a 1/40th Interest in a  Share of 5.700% Fixed-to-Floating Rate Non-Cumulative  Perpetual Preferred Stock Series C,$28.85,-0.17,-0.586%,,United States,,43245,,
RFI,Cohen & Steers Total Return Realty Fund Inc. Common Stock,$14.41,0.26,1.837%,377795789.00,United States,1993,42309,,
RFL,Rafael Holdings Inc. Class B Common Stock,$28.00,1.98,7.61%,459845260.00,United States,2018,70067,Finance,Real Estate
RFM,RiverNorth Flexible Municipal Income Fund Inc. Common Stock,$22.70,0.26,1.159%,0.00,,2020,22565,,
RFP,Resolute Forest Products Inc. Common Stock,$7.90,-0.19,-2.349%,644116475.00,Canada,,520720,Basic Industries,Paper
RGA,Reinsurance Group of America Incorporated Common Stock,$109.54,-3.22,-2.856%,7441821828.00,United States,,496268,Finance,Life Insurance
RGR,Sturm Ruger & Company Inc. Common Stock,$66.76,-1.09,-1.606%,1168026284.00,United States,,174540,Capital Goods,Ordnance And Accessories
RGS,Regis Corporation Common Stock,$10.16,-0.04,-0.392%,362364975.00,United States,1991,298262,Consumer Services,Other Consumer Services
RGT,Royce Global Value Trust Inc. Common Stock,$13.66,0.14,1.036%,143477400.00,,2013,8647,,
RH,RH Common Stock,$486.93,-0.83,-0.17%,9934068797.00,United States,2012,179113,Consumer Services,Other Specialty Stores
RHI,Robert Half International Inc. Common Stock,$70.82,0.45,0.639%,8072066079.00,United States,,679119,Technology,Professional Services
RHP,Ryman Hospitality Properties Inc. (REIT),$70.38,1.38,2.00%,3869584809.00,United States,,303859,Consumer Services,Real Estate Investment Trusts
RICE,Rice Acquisition Corp. Class A Common Stock,$12.11,0.28,2.367%,362196174.00,United States,2020,24091,Finance,Business Services
RIG,Transocean Ltd (Switzerland) Common Stock,$3.51,0.00,0.00%,2159037160.00,Switzerland,,17267613,Energy,Oil & Gas Production
RIO,Rio Tinto Plc Common Stock,$78.48,0.96,1.238%,97863279677.00,Australia,2002,1501235,Basic Industries,Precious Metals
RIV,RiverNorth Opportunities Fund Inc. Common Stock,$17.28,0.12,0.699%,162259200.00,,2015,127133,,
RJF,Raymond James Financial Inc. Common Stock,$109.41,1.52,1.409%,15032934000.00,United States,,547954,Finance,Investment Bankers/Brokers/Service
RKT,Rocket Companies Inc. Class A Common Stock,$21.63,0.06,0.278%,42923697798.00,United States,2020,7166653,Finance,Finance: Consumer Services
RL,Ralph Lauren Corporation Common Stock,$108.50,0.67,0.621%,7931766640.00,United States,1997,1405077,Consumer Non-Durables,Apparel
RLGY,Realogy Holdings Corp. Common Stock,$16.64,0.37,2.274%,1921201884.00,United States,2012,1603620,Finance,Real Estate
RLH,Red Lions Hotels Corporation Common Stock,$3.42,0.00,0.00%,87089955.00,United States,,309076,Consumer Services,Hotels/Resorts
RLI,RLI Corp. Common Stock (DE),$100.80,1.17,1.174%,4541560531.00,United States,,115586,Finance,Property-Casualty Insurers
RLJ,RLJ Lodging Trust Common Shares of Beneficial Interest $0.01 par value,$13.94,-0.04,-0.286%,2300404505.00,United States,2011,529619,Consumer Services,Real Estate Investment Trusts
RLJ^A,RLJ Lodging Trust $1.95 Series A Cumulative Convertible  Preferred Shares,$26.17,0.18,0.693%,,United States,,15506,,
RLX,RLX Technology Inc. American Depositary Shares each representing the right to receive one (1) Class A ordinary share,$24.23,-0.91,-3.62%,37636836261.00,,2021,5401195,Consumer Non-Durables,Farming/Seeds/Milling
RM,Regional Management Corp. Common Stock,$31.15,0.93,3.077%,353109578.00,United States,2012,19321,Finance,Finance: Consumer Services
RMAX,RE/MAX Holdings Inc. Class A Common Stock,$38.28,-0.23,-0.597%,1191151142.00,,2013,75261,Finance,Real Estate
RMD,ResMed Inc. Common Stock,$202.17,-1.89,-0.926%,29417571512.00,United States,,746796,Health Care,Medical/Dental Instruments
RMI,RiverNorth Opportunistic Municipal Income Fund Inc. Common Stock,$21.84,0.19,0.878%,139192173.00,,2018,22306,,
RMM,RiverNorth Managed Duration Municipal Income Fund Inc. Common Stock,$19.15,0.26,1.376%,378011751.00,,2019,51120,,
RMO,Romeo Power Inc. Class A Common Stock,$18.44,0.00,0.00%,2337955064.00,,2019,4458940,Capital Goods,Auto Parts:O.E.M.
RMPL^,RiverNorth Specialty Finance Corporation 5.875% ,$25.2099,0.1099,0.438%,,,,5181,,
RMT,Royce Micro-Cap Trust Inc. Common Stock,$11.63,0.21,1.839%,501240544.00,United States,,138587,,
RNG,RingCentral Inc. Class A Common Stock,$407.17,10.75,2.712%,36495342139.00,,2013,936910,Technology,EDP Services
RNGR,Ranger Energy Services Inc. Class A Common Stock,$5.11,0.07,1.389%,78668021.00,United States,2017,23012,Energy,Oilfield Services/Equipment
RNP,Cohen & Steers REIT and Preferred and Income Fund Inc. Common Shares,$23.16,0.00,0.00%,1102003590.00,United States,2003,106677,,
RNR,RenaissanceRe Holdings Ltd. Common Stock,$159.35,1.14,0.721%,8096732850.00,Bermuda,,421406,Finance,Property-Casualty Insurers
RNR^E,RenaissanceRe Holdings Ltd. 5.375% Series E Preference Shares,$25.3374,-0.2426,-0.948%,,Bermuda,,52286,,
RNR^F,RenaissanceRe Holdings Ltd. Depositary Shares each Representing a 1/1000th Interest in a 5.750% Series F Preference Share,$27.79,-0.04,-0.144%,,Bermuda,,18778,,
ROG,Rogers Corporation Common Stock,$172.10,2.26,1.331%,3214104836.00,United States,,44280,Basic Industries,Major Chemicals
ROK,Rockwell Automation Inc. Common Stock,$242.89,1.62,0.671%,28212907624.00,United States,,894420,Capital Goods,Industrial Machinery/Components
ROL,Rollins Inc. Common Stock,$37.55,0.37,0.995%,18460462913.00,United States,,1760598,Finance,Diversified Commercial Services
ROP,Roper Technologies Inc. Common Stock,$404.95,1.20,0.297%,42468062587.00,United States,1992,494451,Capital Goods,Industrial Machinery/Components
RPAI,Retail Properties of America Inc. Class A Common Stock,$9.63,0.12,1.262%,2063252798.00,United States,2012,1605666,Consumer Services,Real Estate Investment Trusts
RPLA,Replay Acquisition Corp. Ordinary Shares,$10.20,0.02,0.196%,366562500.00,,2019,311009,Finance,Business Services
RPM,RPM International Inc. Common Stock,$86.46,1.47,1.73%,11248686791.00,United States,,544308,Basic Industries,Paints/Coatings
RPT,RPT Realty Common Stock,$9.67,-0.01,-0.103%,782901612.00,United States,,260315,Consumer Services,Real Estate Investment Trusts
RPT^D,RPT Realty 7.25% ,$51.95,-0.06,-0.115%,,United States,,610,,
RQI,Cohen & Steers Quality Income Realty Fund Inc Common Shares,$12.91,0.02,0.155%,1733080086.00,United States,2002,420734,,
RRC,Range Resources Corporation Common Stock,$9.26,-0.05,-0.537%,2373646590.00,United States,,5400083,Energy,Oil & Gas Production
RRD,R.R. Donnelley & Sons Company Common Stock,$2.42,-0.01,-0.412%,172788000.00,United States,,297860,Miscellaneous,Publishing
RS,Reliance Steel & Aluminum Co. Common Stock (DE),$123.74,-0.18,-0.145%,7889202953.00,United States,1994,328239,Basic Industries,Metal Fabrications
RSF,RiverNorth Specialty Finance Corporation,$17.05,0.0504,0.296%,93199818.00,,2019,21983,,
RSG,Republic Services Inc. Common Stock,$90.93,-1.11,-1.206%,28981635607.00,United States,1998,2132681,Public Utilities,Environmental Services
RSI,Rush Street Interactive Inc. Class A Common Stock,$21.31,0.70,3.396%,4364128537.00,,2020,1520012,Consumer Services,Services-Misc. Amusement & Recreation
RTP,Reinvent Technology Partners Class A Ordinary Shares,$13.02,0.29,2.278%,1122975000.00,United States,2020,1073530,Finance,Business Services
RTPZ,Reinvent Technology Partners Z Class A Ordinary Shares,$12.12,-0.19,-1.543%,348450000.00,United States,2021,213345,Finance,Business Services
RTX,Raytheon Technologies Corporation Common Stock,$72.33,-0.35,-0.482%,109848759093.00,United States,,7948891,Capital Goods,Aerospace
RVI,Retail Value Inc. Common Stock ,$17.24,0.04,0.233%,341856511.00,United States,2018,93096,Finance,Real Estate
RVLV,Revolve Group Inc. Class A Common Stock,$38.31,-1.03,-2.618%,2689978446.00,,2019,531026,Consumer Services,Catalog/Specialty Distribution
RVT,Royce Value Trust Inc. Common Stock,$17.73,0.18,1.026%,1781363259.00,United States,1986,192349,,
RWT,Redwood Trust Inc. Common Stock,$9.53,0.15,1.599%,1066674031.00,United States,1995,1197998,Consumer Services,Real Estate Investment Trusts
RXN,Rexnord Corporation Common Stock,$41.85,0.04,0.096%,5033711681.00,United States,2012,898629,Technology,Industrial Machinery/Components
RY,Royal Bank Of Canada Common Stock,$83.52,0.65,0.784%,118854450521.00,Canada,,1323798,Finance,Commercial Banks
RY^T,Royal Bank Of Canada 6.750% Fixed Rate/Floating Rate Noncumulative First Preferred Shares Series C-2,$28.54,-0.13,-0.453%,,Canada,,218,,
RYAM,Rayonier Advanced Materials Inc. Common Stock,$8.20,-0.38,-4.429%,519428729.00,United States,2014,522962,Basic Industries,Paper
RYB,RYB Education Inc. American depositary shares each representing one Class A ordinary share,$3.18,0.48,17.778%,87724580.00,,2017,2643263,Consumer Services,Other Consumer Services
RYI,Ryerson Holding Corporation Common Stock,$13.38,0.11,0.829%,510010772.00,United States,2014,141912,Basic Industries,Metal Fabrications
RYN,Rayonier Inc. REIT Common Stock,$33.34,0.53,1.615%,4551518422.00,United States,,275331,Consumer Services,Real Estate Investment Trusts
RZA,Reinsurance Group of America Incorporated 6.20% Fixed-to-Floating Rate Subordinated Debentures due 2042,$26.86,0.01,0.037%,0.00,United States,,18993,Finance,Life Insurance
RZB,Reinsurance Group of America Incorporated 5.75% Fixed-To-Floating Rate Subordinated Debentures due 2056,$28.86,-0.01,-0.035%,0.00,United States,2016,13864,Finance,Life Insurance
SA,Seabridge Gold Inc. Ordinary Shares (Canada),$19.03,0.34,1.819%,1411466899.00,Canada,,482245,Basic Industries,Precious Metals
SAF,Saratoga Investment Corp 6.25% Notes due 2023,$25.70,0.00,0.00%,0.00,United States,2018,207,,
SAFE,Safehold Inc. Common Stock,$79.02,1.83,2.371%,4194828063.00,United States,2017,108599,Consumer Services,Real Estate
SAH,Sonic Automotive Inc. Common Stock,$42.98,0.88,2.09%,1807307539.00,United States,1997,244604,Consumer Durables,Automotive Aftermarket
SAIC,SCIENCE APPLICATIONS INTERNATIONAL CORPORATION Common Stock,$95.25,0.01,0.01%,5545866861.00,,,353554,Technology,EDP Services
SAIL,SailPoint Technologies Holdings Inc. Common Stock,$59.13,-0.79,-1.318%,5375653701.00,United States,2017,628647,Technology,Computer Software: Prepackaged Software
SAK,Saratoga Investment Corp 7.25% Notes due 2025,$26.4742,0.0742,0.281%,0.00,United States,2020,2563,,
SALT,Scorpio Bulkers Inc. Common Stock,$20.03,0.90,4.705%,225727544.00,Monaco,2013,187899,Transportation,Marine Transportation
SAM,Boston Beer Company Inc. (The) Common Stock,$1123.33,41.49,3.835%,13752488845.00,United States,,96755,Consumer Non-Durables,Beverages (Production/Distribution)
SAN,Banco Santander S.A. Sponsored ADR (Spain),$3.35,0.13,4.037%,57996964512.00,Spain,,6382633,Finance,Commercial Banks
SAND          ,Sandstorm Gold Ltd. Ordinary Shares (Canada),$6.40,0.13,2.073%,1231113069.00,Canada,,3608879,Basic Industries,Precious Metals
SAP,SAP  SE ADS,$130.29,-2.02,-1.527%,155520642605.00,Germany,,569867,Technology,Computer Software: Prepackaged Software
SAR,Saratoga Investment Corp New,$23.80,0.29,1.234%,265846666.00,United States,,61774,,
SAVE,Spirit Airlines Inc. Common Stock,$29.89,-0.33,-1.092%,2919603341.00,United States,,3833020,Transportation,Air Freight/Delivery Services
SB,Safe Bulkers Inc Common Stock ($0.001 par value),$2.37,0.17,7.727%,242153788.00,Monaco,2008,801431,Transportation,Marine Transportation
SB^C,Safe Bulkers Inc Cumulative Redeemable Perpetual Preferred Series C (Marshall Islands),$21.77,0.07,0.323%,,Monaco,,2904,,
SB^D,Safe Bulkers Inc Perpetual Preferred Series D (Marshall Islands),$21.94,0.14,0.642%,,Monaco,,2427,,
SBBA,Scorpio Tankers Inc. 7.00% Senior Notes due 2025,$25.10,-0.05,-0.199%,0.00,Monaco,2020,9345,Transportation,Marine Transportation
SBE,Switchback Energy Acquisition Corporation Class A Common Stock,$40.56,-0.45,-1.097%,1592576394.00,,2019,1927640,Capital Goods,Industrial Specialties
SBG,Sandbridge Acquisition Corporation Class A Common Stock,$10.77,0.05,0.466%,309637500.00,,2020,93156,Finance,Business Services
SBH,Sally Beauty Holdings Inc. (Name to be changed from Sally Holdings Inc.) Common Stock,$14.72,-0.95,-6.063%,1660627026.00,United States,,5356125,Consumer Services,Other Specialty Stores
SBI,Western Asset Intermediate Muni Fund Inc Common Stock,$9.39,0.01,0.107%,132232938.00,United States,1992,24810,,
SBOW,SilverBow Resorces Inc. Common Stock,$6.56,0.18,2.821%,78304614.00,,,46107,Energy,Oil & Gas Production
SBR,Sabine Royalty Trust Common Stock,$31.59,0.86,2.799%,460561509.00,United States,,28613,Energy,Oil & Gas Production
SBS,Companhia de saneamento Basico Do Estado De Sao Paulo - Sabesp American Depositary Shares (Each repstg 250 Common Shares),$7.59,0.11,1.471%,5187839906.00,Brazil,2002,1013645,Public Utilities,Water Supply
SBSW,D/B/A Sibanye-Stillwater Limited ADS,$16.85,0.86,5.378%,12315540748.00,,,2206783,,
SC,Santander Consumer USA Holdings Inc. Common Stock,$25.92,-0.07,-0.269%,7933359594.00,,2014,815844,Finance,Finance: Consumer Services
SCA,Stellus Capital Investment Corporation 5.75% Notes due 2022,$25.33,-0.02,-0.079%,0.00,United States,,250,,
SCCO,Southern Copper Corporation Common Stock,$71.46,1.94,2.791%,55243815803.00,United States,,1371416,Basic Industries,Precious Metals
SCD,LMP Capital and Income Fund Inc. Common Stock,$12.03,0.06,0.501%,216339460.00,United States,2004,57050,,
SCE^G,SCE Trust II Trust Preferred Securities,$25.19,0.12,0.479%,,United States,,1017,,
SCE^H,SCE Trust III Fixed/Floating Rate Trust Preference Securities,$25.00,0.34,1.379%,,United States,,52988,,
