Symbol,Name,Last Sale,Net Change,% Change,Market Cap,Country,IPO Year,Volume,Sector,Industry
IVR^A,Invesco Mortgage Capital Inc. Pfd Ser A,$24.85,0.1072,0.433%,,United States,,16286,,
IVR^B,Invesco Mortgage Capital Inc. Preferred Series B Cum Fxd to Fltg,$24.43,0.17,0.701%,,United States,,4379,,
IVR^C,INVESCO MORTGAGE CAPITAL INC 7.5% Fixed-to-Floating Series C Cumulative Redeemable Preferred Stock Liquation Preference $25.00 per Share,$24.50,0.10,0.41%,,United States,,9893,,
IVZ,Invesco Ltd Common Stock,$21.96,0.18,0.826%,10086999081.00,United States,,4288964,Finance,Investment Managers
IX,Orix Corp Ads Common Stock,$88.04,2.27,2.647%,21527942086.00,Japan,,22711,Finance,Diversified Financial Services
J,Jacobs Engineering Group Inc. Common Stock,$107.45,-0.30,-0.278%,13966499496.00,United States,,580610,Basic Industries,Military/Government/Technical
JAX,J. Alexander's Holdings Inc. Common Stock,$7.88,0.26,3.412%,118752207.00,,2015,20477,Consumer Services,Restaurants
JBGS,JBG SMITH Properties Common Shares ,$31.21,0.19,0.613%,4134223349.00,United States,2017,255528,Consumer Services,Real Estate Investment Trusts
JBK,Lehman ABS 3.50 3.50% Adjustable Corp Backed Tr Certs GS Cap I,$29.80,0.00,0.00%,0.00,United States,,10,Finance,Finance: Consumer Services
JBL,Jabil Inc. Common Stock,$44.58,0.13,0.292%,6694846035.00,United States,1993,812104,Technology,Electrical Products
JBT,John Bean Technologies Corporation Common Stock,$122.21,3.71,3.131%,3877625654.00,United States,,147696,Technology,Industrial Machinery/Components
JCE,Nuveen Core Equity Alpha Fund Nuveen Core Equity Alpha Fund Common Shares of Beneficial Interest,$14.42,0.01,0.069%,231142232.00,United States,2007,62457,,
JCI,Johnson Controls International plc Ordinary Share,$51.05,-0.15,-0.293%,36672855273.00,Switzerland,,3653623,Consumer Services,Other Consumer Services
JCO,Nuveen Credit Opportunities 2022 Target Term Fund Common Shares of Beneficial Interest,$8.27,0.03,0.364%,229417516.00,United States,2017,55251,,
JDD,Nuveen Diversified Dividend and Income Fund Shares of Beneficial Interest,$8.90,0.06,0.679%,175655001.00,United States,2003,63590,,
JE,Just Energy Group Inc. Ordinary Shares (Canada),$7.83,0.31,4.122%,376241906.00,Canada,,2708761,Public Utilities,Oil/Gas Transmission
JEF,Jefferies Financial Group Inc. Common Stock,$25.51,0.19,0.75%,6404820445.00,United States,,4282762,Finance,Investment Bankers/Brokers/Service
JELD,JELD-WEN Holding Inc. Common Stock,$28.00,0.33,1.193%,2821047572.00,United States,2017,184115,Basic Industries,Forest Products
JEMD,Nuveen Emerging Markets Debt 2022 Target Term Fund Common Shares of Beneficial Interest $0.01 par value per share,$7.87,0.03,0.383%,112110220.00,,2017,33806,,
JEQ,Aberdeen Japan Equity Fund Inc.  Common Stock,$9.42,-0.0074,-0.078%,126308409.00,United States,1992,4210,,
JFR,Nuveen Floating Rate Income Fund Common Stock,$9.41,-0.02,-0.212%,535602784.00,United States,2004,511447,,
JGH,Nuveen Global High Income Fund Common Shares of Beneficial Interest,$15.57,-0.05,-0.32%,360872009.00,United States,2014,19762,,
JHAA,Nuveen Corporate Income 2023 Target Term Fund,$9.91,0.02,0.202%,77540042.00,,2018,4275,,
JHB,Nuveen Corporate Income November 2021 Target Term Fund,$9.32,0.05,0.539%,520988457.00,,2016,228936,,
JHG,Janus Henderson Group plc Ordinary Shares,$30.95,1.38,4.667%,5614507436.00,,2017,10420647,Finance,Investment Managers
JHI,John Hancock Investors Trust Common Stock,$18.065,0.095,0.529%,157292407.00,United States,,15654,,
JHS,John Hancock Income Securities Trust Common Stock,$15.71,0.01,0.064%,182967835.00,United States,,6930,,
JHX,James Hardie Industries plc American Depositary Shares (Ireland),$30.47,0.80,2.696%,13533783390.00,Ireland,,44248,Capital Goods,Building Materials
JIH,Juniper Industrial Holdings Inc. Class A Common Stock,$13.23,0.36,2.797%,570543750.00,,2019,687113,Finance,Business Services
JILL,J. Jill Inc. Common Stock,$4.52,-0.11,-2.376%,43481722.00,,2017,119563,Consumer Non-Durables,Apparel
JKS,JinkoSolar Holding Company Limited American Depositary Shares (each representing 4 Common Shares),$63.65,1.22,1.954%,2882953489.00,China,2010,1430897,Technology,Semiconductors
JLL,Jones Lang LaSalle Incorporated Common Stock,$154.26,0.99,0.646%,7913985200.00,United States,,459579,Finance,Real Estate
JLS,Nuveen Mortgage and Income Fund,$20.36,0.10,0.494%,111724278.00,United States,2009,16267,,
JMIA,Jumia Technologies AG American Depositary Shares each representing two Ordinary Shares,$61.23,-3.01,-4.686%,5461510206.00,,2019,6255743,Consumer Services,Catalog/Specialty Distribution
JMM,Nuveen Multi-Market Income Fund (MA),$7.28,0.04,0.552%,68885908.00,United States,,8088,,
JMP,JMP Group LLC Common Shares,$4.32,0.005,0.116%,84956891.00,United States,2007,13528,Finance,Investment Bankers/Brokers/Service
JNJ,Johnson & Johnson Common Stock,$164.45,2.46,1.519%,432921642410.00,United States,,9408447,Health Care,Major Pharmaceuticals
JNPR,Juniper Networks Inc. Common Stock,$24.55,0.14,0.574%,8095027982.00,United States,1999,3977332,Technology,Computer Communications Equipment
JOE,St. Joe Company (The) Common Stock,$53.41,1.55,2.989%,3144916942.00,United States,,225530,Consumer Services,Homebuilding
JOF,Japan Smaller Capitalization Fund Inc Common Stock,$9.03,0.05,0.557%,255855054.00,United States,1990,64803,,
JP,Jupai Holdings Limited American Depositary Shares each representing six ordinary shares,$2.96,0.80,37.037%,99794378.00,,2015,9363802,Consumer Services,Other Consumer Services
JPC,Nuveen Preferred & Income Opportunities Fund,$9.34,0.06,0.647%,965337092.00,United States,2003,244802,,
JPI,Nuveen Preferred and Income Term Fund Common Shares of Beneficial Interest,$24.47,0.14,0.575%,556971238.00,,2012,53896,,
JPM,JP Morgan Chase & Co. Common Stock,$137.98,-0.27,-0.195%,420756212000.00,United States,,10041319,Finance,Major Banks
JPM^C,J P Morgan Chase & Co Depositary Shares each representing a 1/400th interest in a share of 6.00% Non-Cumulative  Preferred Stock Series EE,$27.31,-0.06,-0.219%,,United States,,139296,,
JPM^D,J P Morgan Chase & Co Depositary Shares each representing a 1/400th  interest in a share of 5.75% Non-Cumulative  Preferred Stock Series DD,$27.00,-0.02,-0.074%,,United States,,54251,,
JPM^G,J P Morgan Chase & Co Depositary Shares each representing a 1/400th interest in a share of 6.10% Non-Cumulative Preferred Stock Series AA,$25.63,0.00,0.00%,,United States,,79815,,
JPM^H,J P Morgan Chase & Co Depositary Shares each representing a 1/400th interest in a share of 6.15% Non-Cumulative Preferred Stock Series BB,$25.65,-0.02,-0.078%,,United States,,44197,Finance,Major Banks
JPM^J,J P Morgan Chase & Co Depositary Shares each representing a 1/400th interest in a share of JPMorgan Chase & Co. 4.75% Non-Cumulative Preferred Stock Series GG,$26.03,-0.02,-0.077%,,United States,,71639,Finance,Major Banks
JPS,Nuveen Preferred & Income Securities Fund,$9.67,0.05,0.52%,1970551324.00,United States,2002,462781,,
JPT,Nuveen Preferred and Income 2022 Term Fund Common Shares of Beneficial Interest,$24.38,-0.10,-0.408%,166739208.00,United States,2017,12479,,
JQC,Nuveen Credit Strategies Income Fund Shares of Beneficial Interest,$6.47,0.01,0.155%,877392106.00,United States,2003,1487211,,
JRI,Nuveen Real Asset Income and Growth Fund Common Shares of Beneficial Interest,$13.78,0.08,0.584%,378525300.00,United States,2012,99681,,
JRO,Nuveen Floating Rate Income Opportuntiy Fund Shares of Beneficial Interest,$9.36,0.00,0.00%,379465800.00,United States,2004,92763,,
JRS,Nuveen Real Estate Income Fund Common Shares of Beneficial Interest,$8.78,-0.01,-0.114%,253675895.00,United States,2001,99820,,
JSD,Nuveen Short Duration Credit Opportunities Fund Common Shares of Beneficial Interest,$13.70,-0.05,-0.364%,138173378.00,United States,2011,29965,,
JT,Jianpu Technology Inc. American depositary shares,$3.52,0.03,0.86%,74392338.00,,2017,949142,Technology,Computer Software: Programming Data Processing
JTA,Nuveen Tax-Advantaged Total Return Strategy Fund Common Share of Beneficial Interest,$9.91,0.08,0.814%,137262389.00,United States,2004,73078,,
JTD,Nuveen Tax-Advantaged Dividend Growth Fund Common Shares of Beneficial Interest,$14.25,0.02,0.141%,206401845.00,United States,,27016,,
JW/A,John Wiley & Sons Inc.,$49.98,1.58,3.264%,,United States,,251879,,
JW/B,John Wiley & Sons Inc.,$48.75,-0.43,-0.874%,,United States,,422,,
JWN,Nordstrom Inc. Common Stock,$34.06,0.06,0.176%,5370700623.00,United States,,6375508,Consumer Services,Clothing/Shoe/Accessory Stores
JWS,Jaws Acquisition Corp. Class A Ordinary Shares,$13.30,-0.08,-0.598%,1147125000.00,,2020,1386445,Health Care,Medical/Nursing Services
K,Kellogg Company Common Stock,$58.03,0.16,0.276%,19945663997.00,United States,,2823539,Consumer Non-Durables,Packaged Foods
KAI,Kadant Inc Common Stock,$148.10,0.34,0.23%,1704565836.00,United States,,34174,Technology,Industrial Machinery/Components
KAMN,Kaman Corporation Common Stock,$53.86,-0.45,-0.829%,1490704387.00,United States,,128966,Capital Goods,Military/Government/Technical
KAR,KAR Auction Services Inc Common Stock,$19.80,0.34,1.747%,2559180730.00,United States,2009,1270289,Consumer Durables,Automotive Aftermarket
KB,KB Financial Group Inc,$39.18,1.64,4.369%,15461773245.00,South Korea,,327300,Finance,Commercial Banks
KBH,KB Home Common Stock,$42.55,1.94,4.777%,4202326844.00,United States,1986,1194439,Capital Goods,Homebuilding
KBR,KBR Inc. Common Stock,$30.41,0.08,0.264%,4334247682.00,United States,2006,729680,Basic Industries,Military/Government/Technical
KEN,Kenon Holdings Ltd. Ordinary Shares,$28.50,0.00,0.00%,1535328032.00,Singapore,2015,108,Public Utilities,Electric Utilities: Central
KEP,Korea Electric Power Corporation Common Stock,$10.55,-0.12,-1.125%,13545442025.00,South Korea,1994,76134,Public Utilities,Electric Utilities: Central
KEX,Kirby Corporation Common Stock,$56.08,-1.68,-2.909%,3366987120.00,United States,,493745,Consumer Services,Marine Transportation
KEY,KeyCorp Common Stock,$18.57,-0.14,-0.748%,18120104610.00,United States,,5407514,Finance,Major Banks
KEY^I,KeyCorp Depositary Shares Each Representing a 1/40th Ownership Interest in a Share of Fixed-to-Floating Rate Perpetual Non-Cumulative Preferred Stock Series E,$28.09,-0.13,-0.461%,,United States,,49093,,
KEY^J,KeyCorp Depositary Shares each representing a 1/40th ownership interest in a share of Fixed Rate Perpetual Non-Cumulative Preferred Stock Series F,$26.94,0.04,0.149%,,United States,,12378,,
KEY^K,KeyCorp Depositary Shares each representing a 1/40th ownership interest in a share of Fixed Rate Perpetual Non-Cumulative Preferred Stock Series G,$27.35,0.10,0.367%,,United States,,20717,,
KEYS,Keysight Technologies Inc. Common Stock,$142.95,2.36,1.679%,26600782849.00,United States,2014,1070684,Capital Goods,Industrial Machinery/Components
KF,Korea Fund Inc. (The) New Common Stock,$44.34,0.53,1.21%,223084250.00,United States,,7145,,
KFS,Kingsway Financial Services Inc. Common Stock (DE),$4.54,-0.03,-0.656%,103108253.00,Canada,,33383,Finance,Property-Casualty Insurers
KFY,Korn Ferry Common Stock,$51.25,1.77,3.577%,2764317990.00,United States,1999,280501,Technology,Diversified Commercial Services
KGC,Kinross Gold Corporation Common Stock,$7.24,0.26,3.725%,9110092000.00,Canada,,13700923,Basic Industries,Precious Metals
KIM,Kimco Realty Corporation Common Stock,$16.72,0.02,0.12%,7231377629.00,United States,,2058905,Consumer Services,Real Estate Investment Trusts
KIM^L,Kimco Realty Corporation Class L Depositary Shares each of which represents a one-one thousandth fractional interest in a share of 5.125% Class L Cumulative Redeemable Preferred Stock liquidation preference $25000.00 per share,$26.30,0.11,0.42%,,United States,,4426,,
KIM^M,Kimco Realty Corporation Class M Depositary Shares each of which represents a one-one thousandth fractional interest in a share of 5.25% Class M Cumulative Redeemable Preferred Stock liquidation preference $25000.00 per share,$26.34,0.02,0.076%,,United States,,6435,,
KIO,KKR Income Opportunities Fund Common Shares,$15.10,0.11,0.734%,307138757.00,,2013,85052,,
KKR,KKR & Co. Inc. Common Stock,$44.65,0.79,1.801%,25555163217.00,United States,,2496549,Finance,Investment Managers
KKR^A,KKR & Co. Inc. 6.75% Series A Preferred Stock,$25.88,0.12,0.466%,,United States,,15176,,
KKR^B,KKR & Co. Inc. 6.50% Series B Preferred Stock,$25.92,-0.05,-0.193%,,United States,,5740,,
KKR^C,KKR & Co. Inc. 6.00% Series C Mandatory Convertible Preferred Stock,$63.75,0.66,1.046%,,United States,,49321,,
KL,Kirkland Lake Gold Ltd. Common Shares,$38.34,0.59,1.563%,10237691610.00,,,2100057,Basic Industries,Precious Metals
KMB,Kimberly-Clark Corporation Common Stock,$132.17,0.67,0.51%,44765979000.00,United States,,1535226,Consumer Durables,Containers/Packaging
KMF,Kayne Anderson NextGen Energy & Infrastructure Inc.,$6.40,0.11,1.749%,302063757.00,,2010,214631,,
KMI,Kinder Morgan Inc. Common Stock,$14.15,0.12,0.855%,32029029943.00,United States,2011,18430706,Public Utilities,Natural Gas Distribution
KMPR,Kemper Corporation,$71.69,2.17,3.121%,4689129343.00,United States,,336686,Finance,Property-Casualty Insurers
KMT,Kennametal Inc. Common Stock,$35.74,0.54,1.534%,2976285384.00,United States,,885065,Capital Goods,Industrial Machinery/Components
KMX,CarMax Inc,$126.17,0.51,0.406%,20507854873.00,United States,,1022808,Consumer Durables,Automotive Aftermarket
KN,Knowles Corporation Common Stock,$20.60,0.28,1.378%,1888479806.00,,2014,994584,Consumer Non-Durables,Consumer Electronics/Appliances
KNL,Knoll Inc. Common Stock,$15.92,-0.18,-1.118%,806858284.00,United States,2004,180716,Consumer Durables,Office Equipment/Supplies/Services
KNOP,KNOT Offshore Partners LP Common Units representing Limited Partner Interests,$16.34,0.75,4.811%,534221496.00,United Kingdom,2013,162548,Consumer Services,Marine Transportation
KNX,Knight-Swift Transportation Holdings Inc.,$41.22,0.68,1.677%,7000455955.00,United States,2017,1585585,Transportation,Trucking Freight/Courier Services
KO,Coca-Cola Company (The) Common Stock,$49.65,0.64,1.306%,213367628486.00,United States,,12542931,Consumer Non-Durables,Beverages (Production/Distribution)
KODK,Eastman Kodak Company Common New,$10.72,-0.02,-0.186%,827190855.00,United States,,5572583,Miscellaneous,Industrial Machinery/Components
KOF,Coca Cola Femsa S.A.B. de C.V.  American Depositary Shares each representing 10 Units (each Unit consists of 3 Series B Shares and 5 Series L Shares),$44.90,0.95,2.162%,9432736847.00,Mexico,1993,66232,Consumer Non-Durables,Beverages (Production/Distribution)
KOP,Koppers Holdings Inc. Koppers Holdings Inc. Common Stock,$35.23,0.22,0.628%,742134641.00,United States,2006,103729,Basic Industries,Forest Products
KOS,Kosmos Energy Ltd. Common Shares (DE),$2.68,0.14,5.512%,1086619529.00,Bermuda,2011,6260786,Energy,Oil & Gas Production
KR,Kroger Company (The) Common Stock,$33.15,-0.30,-0.897%,25238655039.00,United States,,8210504,Consumer Services,Food Chains
KRA,Kraton Corporation Common Stock,$34.20,1.16,3.511%,1090018809.00,United States,2009,128539,Basic Industries,Major Chemicals
KRC,Kilroy Realty Corporation Common Stock,$59.09,0.68,1.164%,6810189626.00,United States,1997,1494856,Consumer Services,Real Estate Investment Trusts
KREF,KKR Real Estate Finance Trust Inc. Common Stock,$17.97,0.22,1.239%,999481121.00,United States,2017,456184,Consumer Services,Real Estate Investment Trusts
KRG,Kite Realty Group Trust Common Stock,$16.66,0.19,1.154%,1402831443.00,United States,2004,275444,Consumer Services,Real Estate Investment Trusts
KRO,Kronos Worldwide Inc Common Stock,$14.97,0.28,1.906%,1729674473.00,United States,,129040,Basic Industries,Major Chemicals
KRP,Kimbell Royalty Partners Common Units Representing Limited Partner Interests,$8.75,0.07,0.806%,525718883.00,United States,2017,190822,Energy,Oil & Gas Production
KSM,DWS Strategic Municipal Income Trust,$11.86,0.07,0.594%,132878740.00,United States,1989,21595,,
KSS,Kohl's Corporation Common Stock,$49.53,0.20,0.405%,7808523124.00,United States,1992,2844942,Consumer Services,Department/Specialty Retail Stores
KSU,Kansas City Southern Common Stock,$209.18,-1.82,-0.863%,19003552635.00,United States,,676903,Transportation,Railroads
KSU^,Kansas City Southern Preferred Stock,$37.55,-0.7672,-2.002%,,United States,,317,Transportation,Railroads
KT,KT Corporation Common Stock,$10.41,-0.13,-1.233%,5039317147.00,South Korea,,1936441,Public Utilities,Telecommunications Equipment
KTB,Kontoor Brands Inc. Common Stock ,$41.04,1.76,4.481%,2347708385.00,,2019,316183,Consumer Non-Durables,Apparel
KTF,DWS Municipal Income Trust,$11.77,0.03,0.256%,464926040.00,United States,1988,59134,,
KTH,Structures Products Cp 8% CorTS Issued by Peco Energy Cap Tr II Preferred Stock,$33.2219,-0.1581,-0.474%,0.00,United States,,1155,Finance,Finance: Consumer Services
KTN,Structured Products Corp 8.205% CorTS 8.205% Corporate Backed Trust Securities (CorTS),$32.865,0.00,0.00%,0.00,United States,,52,Finance,Finance: Consumer Services
KUKE,Kuke Music Holding Limited American Depositary Shares each representing one Ordinary Share,$9.16,0.09,0.992%,270831183.00,,2021,30581,Consumer Services,Other Consumer Services
KW,Kennedy-Wilson Holdings Inc. Common Stock,$17.84,0.20,1.134%,2528456028.00,United States,,173874,Finance,Real Estate
KWR,Quaker Chemical Corporation Common Stock,$276.56,1.88,0.684%,4931500659.00,United States,,37758,Basic Industries,Major Chemicals
KYN,Kayne Anderson Energy Infrastructure Fund Inc.,$6.76,0.17,2.58%,854785465.00,United States,2004,514473,,
L,Loews Corporation Common Stock,$47.80,-0.01,-0.021%,13138923282.00,United States,,836451,Finance,Property-Casualty Insurers
LAC,Lithium Americas Corp. Common Shares,$19.69,-0.44,-2.186%,2350467267.00,Canada,,4605105,Basic Industries,Precious Metals
LAD,Lithia Motors Inc. Common Stock,$369.25,11.02,3.076%,9794094452.00,United States,,213042,Consumer Durables,Automotive Aftermarket
LADR,Ladder Capital Corp Class A Common Stock,$10.44,0.01,0.096%,1297352251.00,,2014,933778,Consumer Services,Real Estate Investment Trusts
LAIX,LAIX Inc. American Depositary Shares each  representing one Class A Ordinary Share,$4.09,1.53,59.766%,202096033.00,,2018,128171528,Consumer Services,Other Consumer Services
LAZ,Lazard LTD. Lazard LTD. Class A Common Stock,$42.31,-0.22,-0.517%,4443902355.00,Bermuda,2005,1228002,Finance,Investment Managers
LB,L Brands Inc.,$49.39,1.32,2.746%,13735781927.00,United States,,2766436,Consumer Services,Clothing/Shoe/Accessory Stores
LBRT,Liberty Oilfield Services Inc. Class A Common Stock,$12.63,-0.68,-5.109%,2264051539.00,United States,2018,953086,Energy,Oilfield Services/Equipment
LC,LendingClub Corporation Common Stock,$13.51,0.36,2.738%,1056923696.00,United States,2014,1493578,Finance,Finance: Consumer Services
LCI,Lannett Co Inc Common Stock,$6.17,-0.11,-1.752%,257290832.00,United States,,1495996,Health Care,Major Pharmaceuticals
LCII,LCI Industries,$143.87,4.67,3.355%,3618932308.00,United States,,124267,Capital Goods,Auto Parts:O.E.M.
LDL,Lydall Inc. Common Stock,$32.65,0.28,0.865%,578996457.00,United States,,69616,Capital Goods,Auto Parts:O.E.M.
LDOS,Leidos Holdings Inc. Common Stock,$106.76,-0.51,-0.475%,15194187932.00,United States,,706125,Technology,EDP Services
LDP,Cohen & Steers Limited Duration Preferred and Income Fund Inc.,$26.44,0.075,0.284%,764387592.00,United States,2012,32884,,
LEA,Lear Corporation Common Stock,$155.71,2.49,1.625%,9348639057.00,United States,,619175,Capital Goods,Auto Parts:O.E.M.
LEAF,Leaf Group Ltd. Common Stock,$6.55,0.17,2.665%,233224632.00,United States,,481590,Technology,EDP Services
LEAP,Ribbit LEAP Ltd. Class A Ordinary Shares,$14.10,-0.27,-1.879%,824920500.00,United States,2020,63452,Finance,Business Services
LEE,Lee Enterprises Incorporated Common Stock,$1.89,0.03,1.613%,111064965.00,United States,,802118,Consumer Services,Newspapers/Magazines
LEG,Leggett & Platt Incorporated Common Stock,$43.02,0.42,0.986%,5700963723.00,United States,,996377,Consumer Durables,Home Furnishings
LEJU,Leju Holdings Limited American Depositary Shares each representing one Ordinary share,$3.26,-0.01,-0.306%,444350023.00,,2014,403188,Finance,Real Estate
LEN,Lennar Corporation Class A Common Stock,$90.96,4.09,4.708%,28441469763.00,United States,,3806465,Basic Industries,Homebuilding
LEO,BNY Mellon Strategic Municipals Inc. Common Stock,$8.66,0.14,1.643%,538736539.00,United States,1987,168325,,
LEVI,Levi Strauss & Co Class A Common Stock,$19.99,-0.13,-0.646%,7957215742.00,United States,2019,1613832,Consumer Non-Durables,Apparel
LFC,China Life Insurance Company Limited American Depositary Shares,$10.59,-0.08,-0.75%,59864655780.00,China,2003,543530,Finance,Life Insurance
LFT,Lument Finance Trust Inc. Common Stock,$3.24,0.05,1.567%,80816561.00,United States,2013,95531,Consumer Services,Real Estate Investment Trusts
LGI,Lazard Global Total Return and Income Fund Common Stock,$18.42,0.30,1.656%,239637956.00,United States,2004,54173,,
LGVW,Longview Acquisition Corp. Class A Common Stock,$20.30,0.28,1.399%,1050525000.00,,2020,1579266,Health Care,Medical Electronics
LH,Laboratory Corporation of America Holdings Common Stock,$226.55,2.77,1.238%,22065970000.00,United States,,522559,Health Care,Medical Specialities
LHX,L3Harris Technologies Inc. Common Stock,$182.83,-2.07,-1.12%,38414783725.00,United States,,1700736,Capital Goods,Industrial Machinery/Components
LII,Lennox International Inc. Common Stock,$274.26,1.49,0.546%,10501250570.00,United States,1999,245861,Capital Goods,Industrial Machinery/Components
LIN,Linde plc Ordinary Share,$257.37,8.19,3.287%,135082366563.00,,2018,2806376,Basic Industries,Major Chemicals
LINX,Linx S.A. American Depositary Shares each representing one common share,$7.07,0.12,1.727%,1242151087.00,,2019,46286,Technology,Computer Software: Prepackaged Software
LITB,LightInTheBox Holding Co. Ltd. American Depositary Shares each representing 2 ordinary shares,$3.32,0.12,3.75%,371094912.00,China,2013,761137,Consumer Services,Catalog/Specialty Distribution
LL,Lumber Liquidators Holdings Inc Common Stock,$29.84,0.25,0.845%,861621317.00,United States,2007,377189,Consumer Services,RETAIL: Building Materials
LLY,Eli Lilly and Company Common Stock,$201.77,0.15,0.074%,193009469028.00,United States,,2245468,Health Care,Major Pharmaceuticals
LMND,Lemonade Inc. Common Stock,$144.82,-3.18,-2.149%,8195440410.00,United States,2020,2082727,Finance,Property-Casualty Insurers
LMT,Lockheed Martin Corporation Common Stock,$337.04,-0.19,-0.056%,94406060384.00,United States,,1429380,Capital Goods,Military/Government/Technical
LNC,Lincoln National Corporation Common Stock,$51.08,1.08,2.16%,9871994078.00,United States,,1477630,Finance,Life Insurance
LND,Brasilagro Brazilian Agric Real Estate Co Sponsored ADR (Brazil),$4.5302,0.0802,1.802%,268110487.00,Brazil,,57919,Consumer Non-Durables,Farming/Seeds/Milling
LNFA,L&amp;F Acquisition Corp. Class A Ordinary Shares,$10.25,0.05,0.49%,0.00,United States,2021,32263,Finance,Business Services
LNN,Lindsay Corporation Common Stock,$150.90,2.34,1.575%,1639565621.00,United States,,40318,Capital Goods,Industrial Machinery/Components
LOKB,Live Oak Acquisition Corp. II Class A Common Stock,$11.66,0.67,6.096%,0.00,,2021,294579,Finance,Business Services
LOMA,Loma Negra Compania Industrial Argentina Sociedad Anonima ADS,$5.38,0.05,0.938%,641323976.00,Argentina,2017,284662,Capital Goods,Building Materials
LOW,Lowe's Companies Inc. Common Stock,$175.03,2.00,1.156%,131622560000.00,United States,,2315588,Consumer Services,RETAIL: Building Materials
LPG,Dorian LPG Ltd. Common Stock,$13.45,0.39,2.986%,670980016.00,,2014,558091,Transportation,Marine Transportation
LPI,Laredo Petroleum Inc. Common Stock,$29.90,2.38,8.648%,358913799.00,United States,2011,472800,Energy,Oil & Gas Production
LPL,LG Display Co Ltd AMERICAN DEPOSITORY SHARES,$10.16,-0.17,-1.646%,7270815024.00,South Korea,2004,869156,Capital Goods,Industrial Machinery/Components
LPX,Louisiana-Pacific Corporation Common Stock,$41.73,0.37,0.895%,4562083050.00,United States,,854422,Basic Industries,Forest Products
LRN,Stride Inc. Common Stock,$27.22,-0.01,-0.037%,1132418771.00,United States,,378926,Consumer Services,Other Consumer Services
LSI,Life Storage Inc. Common Stock,$84.08,-0.33,-0.391%,6239738150.00,United States,,306269,Consumer Services,Real Estate Investment Trusts
LSPD,Lightspeed POS Inc. Subordinate Voting Shares,$72.49,-0.11,-0.152%,8539808698.00,,,542478,Technology,Computer Software: Prepackaged Software
LTC,LTC Properties Inc. Common Stock,$40.83,0.48,1.19%,1602260047.00,United States,,157223,Consumer Services,Real Estate Investment Trusts
LTHM,Livent Corporation Common Stock,$19.81,-0.18,-0.90%,2898252862.00,United States,2018,3681974,Basic Industries,Major Chemicals
LU,Lufax Holding Ltd American Depositary Shares two of which representing one Ordinary Share,$17.35,0.15,0.872%,42301832961.00,China,2020,3816145,Finance,Finance: Consumer Services
LUB,Luby's Inc. Common Stock,$3.24,0.08,2.532%,99604022.00,United States,,77285,Consumer Services,Restaurants
LUMN,Lumen Technologies Inc. Common Stock,$12.23,0.49,4.174%,13417914943.00,United States,,13795399,Capital Goods,Industrial Specialties
LUV,Southwest Airlines Company Common Stock,$50.05,0.92,1.873%,29553240567.00,United States,,10439541,Transportation,Air Freight/Delivery Services
LVS,Las Vegas Sands Corp. Common Stock,$55.57,2.62,4.948%,42445929017.00,United States,2004,12963138,Consumer Services,Hotels/Resorts
LW,Lamb Weston Holdings Inc. Common Stock ,$79.50,0.28,0.353%,11635229019.00,,2016,338741,Consumer Non-Durables,Packaged Foods
LXP,Lexington Realty Trust Common Stock,$10.93,0.19,1.769%,3027090978.00,United States,,914165,,
LXP^C,Lexington Realty Trust  Preferred Conv. Series C,$56.01,-0.09,-0.16%,,United States,,307,,
