Symbol,Name,Last Sale,Net Change,% Change,Market Cap,Country,IPO Year,Volume,Sector,Industry
CUZ,Cousins Properties Incorporated Common Stock,$33.60,0.96,2.941%,4991762362.00,United States,,896470,Consumer Services,Real Estate Investment Trusts
CVA,Covanta Holding Corporation Common Stock,$14.48,-0.19,-1.295%,1911096102.00,United States,,673003,Basic Industries,Electric Utilities: Central
CVE,Cenovus Energy Inc Common Stock,$6.35,0.04,0.634%,12810413203.00,Canada,,11324506,Energy,Oil & Gas Production
CVEO,Civeo Corporation (Canada) Common Shares,$17.49,0.95,5.744%,248623306.00,,2014,46065,Consumer Services,Hotels/Resorts
CVI,CVR Energy Inc. Common Stock,$18.31,0.07,0.384%,1840715268.00,United States,2007,250669,Energy,Integrated oil Companies
CVNA,Carvana Co. Class A Common Stock,$288.15,3.62,1.272%,49498122884.00,United States,2017,936540,Consumer Durables,Automotive Aftermarket
CVS,CVS Health Corporation Common Stock,$72.18,-0.82,-1.123%,94477376286.00,United States,,6411241,Health Care,Medical/Nursing Services
CVX,Chevron Corporation Common Stock,$89.26,0.26,0.292%,171826409827.00,United States,,7980581,Energy,Integrated oil Companies
CW,Curtiss-Wright Corporation Common Stock,$112.72,-0.98,-0.862%,4678108371.00,United States,,170054,Technology,Industrial Machinery/Components
CWEN,Clearway Energy Inc. Class C Common Stock,$32.43,0.53,1.661%,6539055156.00,United States,2015,658579,Public Utilities,Electric Utilities: Central
CWH,Camping World Holdings Inc. Class A Commom Stock,$39.72,0.09,0.227%,3525406353.00,United States,2016,1159816,Consumer Durables,Automotive Aftermarket
CWK,Cushman & Wakefield plc Ordinary Shares,$15.64,0.05,0.321%,3466286271.00,,2018,308058,Finance,Real Estate
CWT,California Water Service Group Common Stock,$57.48,1.47,2.625%,2864803200.00,United States,,139910,Public Utilities,Water Supply
CX,Cemex S.A.B. de C.V. Sponsored ADR,$6.43,0.02,0.312%,9713885452.00,Mexico,,5108050,Capital Goods,Building Materials
CXE,MFS High Income Municipal Trust Common Stock,$5.13,0.07,1.383%,161705546.00,United States,1989,209533,,
CXH,MFS Investment Grade Municipal Trust Common Stock,$9.97,-0.03,-0.30%,90829143.00,United States,1989,2732,,
CXP,Columbia Property Trust Inc. Common Stock,$14.08,0.11,0.787%,1611667284.00,United States,2013,901675,Consumer Services,Real Estate Investment Trusts
CXW,CoreCivic Inc. Common Stock,$7.19,-0.05,-0.691%,860170013.00,United States,,1326211,Consumer Services,Real Estate Investment Trusts
CYD,China Yuchai International Limited Common Stock,$16.99,0.32,1.92%,694182364.00,Singapore,1994,25011,Energy,Industrial Machinery/Components
CYH,Community Health Systems Inc. Common Stock,$9.22,0.01,0.109%,1102905177.00,United States,2000,1237098,Health Care,Hospital/Nursing Management
CZZ,Cosan Limited Class A Common Stock,$18.35,0.20,1.102%,4099680554.00,Brazil,,325309,Consumer Non-Durables,Specialty Foods
D,Dominion Energy Inc. Common Stock,$73.74,1.05,1.444%,60158500065.00,United States,,3008634,Public Utilities,Electric Utilities: Central
DAC,Danaos Corporation Common Stock,$32.82,0.46,1.422%,671170346.00,Greece,2006,460511,Transportation,Marine Transportation
DAL,Delta Air Lines Inc. Common Stock,$41.15,0.22,0.538%,26242766486.00,United States,,10038790,Transportation,Air Freight/Delivery Services
DAN,Dana Incorporated Common Stock ,$22.06,0.36,1.659%,3187476137.00,United States,,2191268,Capital Goods,Auto Parts:O.E.M.
DAO,Youdao Inc. American Depositary Shares each representing one Class A Ordinary Share,$36.63,-1.27,-3.351%,4094052902.00,,2019,278122,Consumer Services,Other Consumer Services
DAR,Darling Ingredients Inc. Common Stock,$67.74,-1.50,-2.166%,10978519106.00,United States,,1025247,Consumer Non-Durables,Packaged Foods
DASH,DoorDash Inc. Class A Common Stock,$181.23,-8.10,-4.278%,57568891301.00,,2020,1516523,Miscellaneous,Business Services
DAVA,Endava plc American Depositary Shares (each representing one Class A Ordinary Share),$86.07,1.15,1.354%,4743949884.00,,2018,360267,Technology,EDP Services
DB,Deutsche Bank AG Common Stock,$10.32,-0.09,-0.865%,21305362712.00,Germany,,2368517,Finance,Major Banks
DBD,Diebold Nixdorf Incorporated Common Stock,$13.63,0.09,0.665%,1058756905.00,United States,,475837,Miscellaneous,Office Equipment/Supplies/Services
DBI,Designer Brands Inc. Class A Common Stock,$12.73,0.34,2.744%,921561324.00,United States,,1577846,Consumer Services,Clothing/Shoe/Accessory Stores
DBL,DoubleLine Opportunistic Credit Fund Common Shares of Beneficial Interest,$19.96,0.14,0.706%,298539644.00,United States,2012,54489,,
DCF,BNY Mellon Alcentra Global Credit Income 2024 Target Term Fund Inc. Common Stock,$8.96,0.06,0.674%,134069663.00,,2017,43571,,
DCI,Donaldson Company Inc. Common Stock,$61.51,0.52,0.853%,7765017418.00,United States,,335731,Capital Goods,Pollution Control Equipment
DCO,Ducommun Incorporated Common Stock,$54.34,-0.52,-0.948%,636570821.00,United States,,25418,Capital Goods,Military/Government/Technical
DCP,DCP Midstream  LP Common Units ,$20.96,-0.14,-0.664%,4367048027.00,United States,,1073173,Public Utilities,Natural Gas Distribution
DCP^B,DCP Midstream LP 7.875% Series B Fixed-to-Floating Rate Cumulative Redeemable Perpetual Preferred Units,$22.73,0.13,0.575%,,United States,,4130,,
DCP^C,DCP Midstream LP 7.95% Series C Fixed-to-Floating Rate Cumulative Redeemable Perpetual Preferred Units,$22.33,0.11,0.495%,,United States,,20412,,
DCUE,Dominion Energy Inc. 2019 Series A Corporate Units,$99.22,0.97,0.987%,0.00,United States,2019,29722,Public Utilities,Electric Utilities: Central
DD,DuPont de Nemours Inc. Common Stock,$75.84,-1.14,-1.481%,55655154043.00,,2017,19019690,Basic Industries,Major Chemicals
DDD,3D Systems Corporation Common Stock,$47.95,3.55,7.995%,5952605783.00,United States,,5993763,Technology,Computer Software: Prepackaged Software
DDF,Delaware Investments Dividend & Income Fund Inc. Common Stock,$9.58,0.04,0.419%,73652554.00,United States,1993,42508,,
DDS,Dillard's Inc. Common Stock,$80.93,0.78,0.973%,1780289400.00,United States,,480504,Consumer Services,Department/Specialty Retail Stores
DDT,Dillard's Capital Trust I,$25.53,-0.172,-0.669%,0.00,United States,,7709,Consumer Services,Department/Specialty Retail Stores
DE,Deere & Company Common Stock,$309.24,-0.03,-0.01%,97231656419.00,United States,,1226462,Capital Goods,Industrial Machinery/Components
DEA,Easterly Government Properties Inc. Common Stock,$22.75,0.05,0.22%,1848013554.00,United States,2015,478800,Consumer Services,Real Estate Investment Trusts
DECK,Deckers Outdoor Corporation Common Stock,$316.73,-0.15,-0.047%,8895064324.00,United States,1993,505142,Consumer Non-Durables,Shoe Manufacturing
DEH,D8 Holdings Corp. Class A Ordinary Shares,$10.42,0.00,0.00%,449362500.00,Hong Kong,2020,63208,Finance,Business Services
DEI,Douglas Emmett Inc. Common Stock,$29.37,0.74,2.585%,5150760402.00,United States,2006,1558151,Consumer Services,Real Estate Investment Trusts
DELL,Dell Technologies Inc. Class C Common Stock ,$79.61,0.30,0.378%,59691926533.00,,2018,1791978,Technology,Computer Manufacturing
DEN,Denbury Inc. Common Stock,$33.06,0.44,1.349%,1652999967.00,,2020,419444,Energy,Oil & Gas Production
DEO,Diageo plc Common Stock,$162.82,0.53,0.327%,95237902714.00,United Kingdom,,924037,Consumer Non-Durables,Beverages (Production/Distribution)
DESP,Despegar.com Corp. Ordinary Shares,$11.36,0.38,3.461%,794586560.00,,2017,250114,Consumer Services,Transportation Services
DEX,Delaware Enhanced Global Dividend Common Shares of Beneficial Interest,$9.70,0.04,0.414%,116471159.00,United States,2007,25873,,
DFIN,Donnelley Financial Solutions Inc. Common Stock ,$20.09,-0.30,-1.471%,670511183.00,,2016,276326,Consumer Services,Other Consumer Services
DFNS,LGL Systems Acquisition Corp. Common Stock,$11.14,-0.01,-0.09%,240206250.00,United States,2020,385694,Finance,Business Services
DFP,Flaherty & Crumrine Dynamic Preferred and Income Fund Inc. Common Stock,$29.61,0.04,0.135%,567675784.00,,2013,45236,,
DFS,Discover Financial Services Common Stock,$92.84,1.34,1.464%,28501880000.00,United States,,2443089,Finance,Finance: Consumer Services
DG,Dollar General Corporation Common Stock,$193.82,-1.90,-0.971%,47486075019.00,United States,2009,3743064,Consumer Services,Department/Specialty Retail Stores
DGNR,Dragoneer Growth Opportunities Corp. Class A Ordinary Shares,$12.38,-0.90,-6.777%,1067775000.00,United States,2020,1326508,Finance,Business Services
DGX,Quest Diagnostics Incorporated Common Stock,$121.79,-0.20,-0.164%,16413149191.00,United States,,1410111,Health Care,Medical Specialities
DHF,BNY Mellon High Yield Strategies Fund Common Stock,$3.01,0.01,0.333%,218850141.00,United States,1998,4146695,,
DHI,D.R. Horton Inc. Common Stock,$80.02,2.94,3.814%,29103410994.00,United States,,2912616,Capital Goods,Homebuilding
DHR,Danaher Corporation Common Stock,$235.59,0.06,0.025%,167504490000.00,United States,,1470933,Capital Goods,Industrial Machinery/Components
DHR^A,Danaher Corporation 4.75% Mandatory Convertible Preferred Stock Series A,$1614.41,-8.59,-0.529%,,United States,,2262,,
DHR^B,Danaher Corporation 5.00% Mandatory Convertible Preferred Stock Series B,$1355.00,-13.44,-0.982%,,United States,,12715,,
DHT,DHT Holdings Inc.,$5.97,0.36,6.417%,1019666018.00,Jersey,2005,4770603,Transportation,Marine Transportation
DHX,DHI Group Inc. Common Stock,$2.46,-0.08,-3.15%,128995773.00,United States,2007,148785,Miscellaneous,Business Services
DIAX,Nuveen Dow 30SM Dynamic Overwrite Fund Common Shares of Beneficial Interest,$15.05,0.02,0.133%,547322041.00,,2014,104235,,
DIN,Dine Brands Global Inc. Common Stock,$76.30,0.02,0.026%,1252750549.00,United States,,216182,Consumer Services,Restaurants
DIS,Walt Disney Company (The) Common Stock,$181.16,0.93,0.516%,328672031457.00,United States,,6534247,Consumer Services,Services-Misc. Amusement & Recreation
DK,Delek US Holdings Inc. Common Stock,$21.39,-0.55,-2.507%,1576993964.00,United States,2017,702895,Energy,Integrated oil Companies
DKL,Delek Logistics Partners L.P. Common Units representing Limited Partner Interests,$38.31,1.07,2.873%,1663927386.00,United States,2012,48611,Energy,Natural Gas Distribution
DKS,Dick's Sporting Goods Inc Common Stock,$75.64,1.59,2.147%,6777243777.00,United States,2002,1571967,Consumer Services,Other Specialty Stores
DL,China Distance Education Holdings Limited American Depositary Shares,$9.65,0.01,0.104%,326460542.00,China,,16418,Consumer Services,Other Consumer Services
DLB,Dolby Laboratories Common Stock,$91.33,-0.55,-0.599%,9280311911.00,United States,2005,328430,Miscellaneous,Multi-Sector Companies
DLNG,Dynagas LNG Partners LP Common Units,$2.72,-0.11,-3.887%,96866218.00,Greece,,102654,Consumer Services,Marine Transportation
DLNG^A,Dynagas LNG Partners LP 9.00% Series A Cumulative Redeemable Preferred Units,$24.3847,0.0846,0.348%,,Greece,,2036,,
DLNG^B,Dynagas LNG Partners LP 8.75% Series B Fixed to Floating Rate Cumulative Redeemable Perpetual Preferred Units liquidation preference $25.00 per Uni,$21.86,0.36,1.674%,,Greece,,10224,,
DLR,Digital Realty Trust Inc. Common Stock,$145.56,0.51,0.352%,40780844037.00,United States,2004,1442554,Consumer Services,Real Estate Investment Trusts
DLR^C,Digital Realty Trust Inc. 6.625% Series C Cumulative Redeemable Perpetual Preferred Stock,$25.74,-0.07,-0.271%,,United States,,16481,,
DLR^J,Digital Realty Trust Inc. 5.250% Series J Cumulative Redeemable Preferred Stock,$26.25,0.07,0.267%,,United States,,4409,,
DLR^K,Digital Realty Trust Inc. 5.850% Series K Cumulative Redeemable Preferred Stock par value $0.01 per share,$27.48,0.11,0.402%,,United States,,6688,,
DLR^L,Digital Realty Trust Inc. 5.200% Series L Cumulative Redeemable Preferred Stock,$26.92,-0.03,-0.111%,,United States,,21065,,
DLX,Deluxe Corporation Common Stock,$37.28,0.04,0.107%,1561807873.00,United States,,940209,Consumer Durables,Publishing
DLY,DoubleLine Yield Opportunities Fund Common Shares of Beneficial Interest,$19.30,0.262,1.376%,0.00,,2020,198785,,
DM,Desktop Metal Inc. Class A Common Stock,$31.25,4.18,15.441%,7084530656.00,,2019,6084098,Technology,Industrial Machinery/Components
DMB,BNY Mellon Municipal Bond Infrastructure Fund Inc. Common Stock,$14.84,0.01,0.067%,272871583.00,,2013,23720,,
DMO,Western Asset Mortgage Opportunity Fund Inc. Common Stock,$14.33,0.08,0.561%,157401838.00,United States,2010,81473,,
DMS,Digital Media Solutions Inc. Class A Ordinary Shares,$12.25,-0.29,-2.313%,715302502.00,United States,2018,168170,Miscellaneous,Business Services
DMYD,dMY Technology Group Inc. II Class A Common Stock,$20.78,0.06,0.29%,716910000.00,United States,2020,493855,Finance,Business Services
DMYI,dMY Technology Group Inc. III Class A Common Stock,$11.76,-0.23,-1.918%,445777500.00,United States,2021,161039,Finance,Business Services
DNB,Dun & Bradstreet Holdings Inc. Common Stock,$25.83,0.42,1.653%,10927099669.00,United States,2020,2198231,Finance,Finance: Consumer Services
DNK,Phoenix Tree Holdings Limited American Depositary Shares each representing ten (10) Class A ordinary shares,$2.81,-0.01,-0.355%,513892800.00,,2020,393734,Consumer Services,Building operators
DNMR,Danimer Scientific Inc. Common Stock,$56.59,7.83,16.058%,4851153416.00,,2020,2613043,Basic Industries,Major Chemicals
DNOW,NOW Inc. Common Stock,$9.67,0.09,0.939%,1057700993.00,,2014,910951,Energy,Metal Fabrications
DNP,DNP Select Income Fund Inc. Common Stock,$10.31,0.00,0.00%,3188909280.00,United States,1987,369651,,
DOC,Physicians Realty Trust Common Shares of Beneficial Interest,$18.22,0.02,0.11%,3793946081.00,United States,2013,1867014,Consumer Services,Real Estate Investment Trusts
DOOR,Masonite International Corporation Ordinary Shares (Canada),$107.74,0.06,0.056%,2639949665.00,Canada,,86205,Basic Industries,Forest Products
DOV,Dover Corporation Common Stock,$121.06,1.23,1.026%,17445145377.00,United States,,556798,Technology,Industrial Machinery/Components
DOW,Dow Inc. Common Stock ,$57.24,0.90,1.597%,42540189590.00,,2019,3721976,Basic Industries,Major Chemicals
DPG,Duff & Phelps Utility and Infrastructure Fund Inc.,$13.21,0.21,1.615%,501052737.00,United States,2011,102536,,
DPZ,Domino's Pizza Inc Common Stock,$377.23,4.23,1.134%,14862826540.00,United States,2004,494364,Consumer Non-Durables,Food Distributors
DQ,DAQO New Energy Corp. American Depositary Shares each representing five ordinary shares,$109.19,0.52,0.479%,7586939398.00,China,2010,1403822,Technology,Semiconductors
DRD,DRDGOLD Limited American Depositary Shares,$10.48,0.44,4.382%,896159252.00,South Africa,,283342,Basic Industries,Precious Metals
DRE,Duke Realty Corporation Common Stock,$41.38,0.33,0.804%,15391339456.00,United States,,1188050,Consumer Services,Real Estate Investment Trusts
DRH,Diamondrock Hospitality Company Common Stock,$8.82,-0.09,-1.01%,1759756522.00,United States,2005,1170173,Consumer Services,Real Estate Investment Trusts
DRH^A,Diamondrock Hospitality Company 8.250% Series A Cumulative Redeemable Preferred Stock,$26.86,0.08,0.299%,,United States,,6232,,
DRI,Darden Restaurants Inc. Common Stock,$131.98,3.29,2.557%,17200711481.00,United States,,2174507,Consumer Services,Restaurants
DRQ,Dril-Quip Inc. Common Stock,$31.77,-0.36,-1.12%,1114993407.00,United States,1997,143920,Energy,Metal Fabrications
DRUA,Dominion Energy Inc. 2016 Series A 5.25% Enhanced Junior Subordinated Notes due 2076,$25.55,-0.05,-0.195%,0.00,United States,2016,32873,Public Utilities,Electric Utilities: Central
DS,Drive Shack Inc.,$2.45,0.06,2.51%,164708463.00,United States,,4591214,Consumer Services,Restaurants
DS^B,Drive Shack Inc. Preferred Series B,$20.6001,-1.0599,-4.893%,,United States,,22530,,
DS^C,Drive Shack Inc. Preferred Series C,$20.72,0.2399,1.171%,,United States,,2658,,
DS^D,Drive Shack Inc. Pfd Ser D,$20.0026,-0.5074,-2.474%,,United States,,5868,,
DSE,Duff & Phelps Select MLP and Midstream Energy Fund Inc.,$6.60,1.22,22.677%,17314136.00,United States,2014,171652,,
DSL,DoubleLine Income Solutions Fund Common Shares of Beneficial Interests,$17.28,0.24,1.408%,1761815370.00,,2013,676527,,
DSM,BNY Mellon Strategic Municipal Bond Fund Inc. Common Stock,$7.96,0.05,0.632%,393395228.00,United States,1989,79241,,
DSSI,Diamond S Shipping Inc. Common Stock ,$7.78,0.46,6.284%,314627814.00,,2019,325072,Consumer Services,Transportation Services
DSU,Blackrock Debt Strategies Fund Inc. Common Stock,$10.74,0.03,0.28%,502452041.00,United States,1998,126892,,
DSX,Diana Shipping inc. common stock,$2.61,-0.02,-0.76%,233007755.00,Greece,2005,768267,Transportation,Marine Transportation
DSX^B,Diana Shipping Inc. Perpetual Preferred Shares Series B (Marshall Islands),$25.25,-0.20,-0.786%,,Greece,,7877,,
DT,Dynatrace Inc. Common Stock,$55.46,3.71,7.169%,15645072722.00,United States,2019,3745066,Technology,Computer Software: Prepackaged Software
DTB,DTE Energy Company 2020 Series G 4.375% Junior Subordinated Debentures due 2080,$25.31,-0.11,-0.433%,0.00,United States,2020,25985,Public Utilities,Electric Utilities: Central
DTE,DTE Energy Company Common Stock,$121.72,2.02,1.688%,23560073660.00,United States,,970020,Public Utilities,Electric Utilities: Central
DTF,DTF Tax-Free Income Inc. Common Stock,$14.45,0.02,0.139%,101577229.00,United States,1991,18731,,
DTJ,DTE Energy Company 2016 Series B 5.375% Junior Subordinated Debentures due 2076,$25.74,0.01,0.039%,0.00,United States,2016,12595,Public Utilities,Electric Utilities: Central
DTLA^,Brookfield DTLA Inc. 7.625% Series A Cumulative Redeemable Preferred Stock,$13.53,0.39,2.968%,,,,1763,,
DTP,DTE Energy Company 6.25% Corporate Units,$47.16,0.67,1.441%,0.00,United States,,124091,Public Utilities,Electric Utilities: Central
DTW,DTE Energy Company 2017 Series E 5.25% Junior Subordinated Debentures due 2077,$26.16,-0.02,-0.076%,0.00,United States,2017,22682,Public Utilities,Electric Utilities: Central
DTY,DTE Energy Company 2016 Series F 6.00% Junior Subordinated Debentures due 2076,$26.56,-0.14,-0.524%,0.00,United States,2016,7383,Public Utilities,Electric Utilities: Central
DUC,Duff & Phelps Utility & Corporate Bond Trust Inc. Common Stock,$10.16,-0.14,-1.359%,279345979.00,United States,1993,31154,,
DUK,Duke Energy Corporation (Holding Company) Common Stock,$94.74,0.39,0.413%,69724713974.00,United States,,2170889,Public Utilities,Power Generation
DUK^A,Duke Energy Corporation Depositary Shares each representing a 1/1000th interest in a share of 5.75% Series A Cumulative Redeemable Perpetual Preferred Stock,$28.18,0.19,0.679%,,United States,,62962,Public Utilities,Power Generation
DUKB,Duke Energy Corporation 5.625% Junior Subordinated Debentures due 2078,$27.61,0.12,0.437%,0.00,United States,2018,15387,Public Utilities,Power Generation
DUKH,Duke Energy Corporation 5.125% Junior Subordinated Debentures due 2073,$26.02,0.03,0.115%,0.00,United States,,22138,Public Utilities,Power Generation
DVA,DaVita Inc. Common Stock,$109.18,-0.36,-0.329%,12223081056.00,United States,,791644,Health Care,Misc Health and Biotechnology Services
DVD,Dover Motorsports Inc. Common Stock,$2.17,0.01,0.463%,78928069.00,United States,1996,91789,Consumer Services,Services-Misc. Amusement & Recreation
DVN,Devon Energy Corporation Common Stock,$17.90,-0.25,-1.377%,12048619435.00,United States,,9375764,Energy,Oil & Gas Production
DWIN,Delwinds Insurance Acquisition Corp. Class A Common Stock,$10.10,-0.035,-0.345%,0.00,,2021,100677,Finance,Business Services
DX,Dynex Capital Inc. Common Stock,$18.45,0.45,2.50%,487965047.00,United States,,680713,Consumer Services,Real Estate Investment Trusts
DX^B,Dynex Capital Inc. Preferred Series B,$25.14,0.00,0.00%,,United States,,16399,,
DX^C,Dynex Capital Inc. 6.900% Series C Fixed-to-Floating Rate Cumulative Redeemable Preferred Stock,$24.95,-0.15,-0.598%,,United States,,19709,,
DXC,DXC Technology Company Common Stock ,$25.94,-0.50,-1.891%,6599451379.00,,,4759838,Technology,EDP Services
DY,Dycom Industries Inc. Common Stock,$90.30,0.73,0.815%,2881760425.00,United States,,219512,Basic Industries,Water Supply
DYFN,Angel Oak Dynamic Financial Strategies Income Term Trust Common Shares of Beneficial Interest,$18.66,0.12,0.647%,0.00,,2020,45771,,
E,ENI S.p.A. Common Stock,$20.69,0.00,0.00%,36662257593.00,Italy,,235651,Energy,Oil & Gas Production
EAF,GrafTech International Ltd. Common Stock,$11.00,0.72,7.004%,2939109734.00,United States,2018,2416811,Energy,Industrial Machinery/Components
EAI,Entergy Arkansas LLC First Mortgage Bonds 4.875% Series Due September 1 2066,$25.78,-0.21,-0.808%,0.00,United States,2016,17368,Public Utilities,Electric Utilities: Central
EARN,Ellington Residential Mortgage REIT Common Shares of Beneficial Interest,$12.23,-0.02,-0.163%,150852598.00,United States,2013,169251,Consumer Services,Real Estate Investment Trusts
EAT,Brinker International Inc. Common Stock,$65.64,0.99,1.531%,2984000767.00,United States,,1041159,Consumer Services,Restaurants
EB,Eventbrite Inc. Class A Common Stock,$17.98,0.18,1.011%,1647791916.00,United States,2018,1116407,Technology,Computer Software: Programming Data Processing
EBF,Ennis Inc. Common Stock,$19.12,-0.06,-0.313%,498449662.00,United States,,67441,Consumer Services,Office Equipment/Supplies/Services
EBR,Centrais Electricas Brasileiras S A American Depositary Shares (Each representing one Common Share),$5.76,0.07,1.23%,9037042042.00,,2016,939943,Public Utilities,Electric Utilities: Central
EBS,Emergent Biosolutions Inc. Common Stock,$117.55,1.12,0.962%,6230048789.00,United States,2006,433881,Health Care,Major Pharmaceuticals
EC,Ecopetrol S.A. American Depositary Shares,$12.13,0.15,1.252%,24937275323.00,Colombia,,1152385,Energy,Oil & Gas Production
ECC           ,Eagle Point Credit Company Inc. Common Stock,$11.39,-0.05,-0.437%,360784332.00,United States,2014,89967,,
ECCB,Eagle Point Credit Company Inc. 7.75% Series B Term Preferred Stock due 2026,$25.1768,0.0168,0.067%,0.00,United States,2016,31108,,
ECCX,Eagle Point Credit Company Inc. 6.6875% Notes due 2028,$25.33,0.08,0.317%,0.00,United States,2018,9425,,
ECCY,Eagle Point Credit Company Inc. 6.75% Notes due 2027,$25.199,0.00,0.00%,0.00,United States,2017,140,,
ECL,Ecolab Inc. Common Stock,$212.78,4.65,2.234%,60737026039.00,United States,,717332,Basic Industries,Package Goods/Cosmetics
ECOM          ,ChannelAdvisor Corporation Common Stock,$23.19,1.30,5.939%,672513479.00,United States,2013,488835,Technology,Computer Software: Prepackaged Software
ED,Consolidated Edison Inc. Common Stock,$71.50,0.91,1.289%,23946473122.00,United States,,1634128,Public Utilities,Power Generation
EDD,Morgan Stanley Emerging Markets Domestic Debt Fund Inc. Morgan Stanley Emerging Markets Domestic Debt Fund Inc. Common Stock,$6.16,0.03,0.489%,407127490.00,United States,2007,125231,,
EDF,Stone Harbor Emerging Markets Income Fund Common Shares of Beneficial Interest,$8.52,0.08,0.948%,142078412.00,United States,2010,139931,,
EDI,Stone Harbor Emerging Markets Total Income Fund Common Shares of Beneficial Interests,$9.34,0.07,0.755%,92261996.00,United States,2012,49426,,
EDN,Empresa Distribuidora Y Comercializadora Norte S.A. (Edenor) Empresa Distribuidora Y Comercializadora Norte S.A. (Edenor) American Depositary Shares,$3.62,-0.10,-2.688%,158388434.00,Argentina,2007,45452,Public Utilities,Electric Utilities: Central
EDU,New Oriental Education & Technology Group Inc. Sponsored ADR representing 1 Ordinary Share (Cayman Islands),$184.54,1.59,0.869%,31402412787.00,China,2006,646748,Consumer Services,Other Consumer Services
EEA,The European Equity Fund Inc. Common Stock,$10.425,0.055,0.53%,77720804.00,United States,,7312,,
EEX,Emerald Holding Inc. Common Stock,$4.60,-0.16,-3.361%,328627128.00,United States,2017,155271,Miscellaneous,Business Services
EFC,Ellington Financial Inc. Common Stock ,$15.74,0.23,1.483%,689123706.00,United States,2010,223150,Finance,Real Estate
EFC^A,Ellington Financial Inc. 6.750% Series A Fixed-to-Floating Rate Cumulative Redeemable Preferred Stock,$23.81,0.21,0.89%,,United States,,23673,,
EFF,Eaton vance Floating-Rate Income Plus Fund Common Shares of Beneficial Interest,$15.91,0.13,0.824%,121018174.00,,2013,4881,,
EFL,Eaton Vance Floating-Rate 2022 Target Term Trust Common Shares of Beneficial Interest,$9.28,0.04,0.433%,219208559.00,United States,2017,66111,,
EFR,Eaton Vance Senior Floating-Rate Fund Common Shares of Beneficial Interest,$13.43,-0.03,-0.223%,494872844.00,United States,2003,219181,,
EFT,Eaton Vance Floating Rate Income Trust Common Shares of Beneficial Interest,$13.81,0.00,0.00%,550517559.00,United States,2004,64991,,
EFX,Equifax Inc. Common Stock,$178.64,-2.25,-1.244%,21730297481.00,United States,,534342,Finance,Finance: Consumer Services
EGF,Blackrock Enhanced Government Fund Inc. Common Stock,$13.23,0.07,0.532%,56379499.00,United States,2005,3196,,
EGHT,8x8 Inc Common Stock,$35.79,1.04,2.993%,3846937325.00,United States,,2000265,Technology,EDP Services
EGO,Eldorado Gold Corporation Ordinary Shares,$12.96,1.46,12.696%,2265393381.00,Canada,,7341110,Basic Industries,Precious Metals
EGP,EastGroup Properties Inc. Common Stock,$145.75,1.09,0.753%,5765422548.00,United States,,129207,Consumer Services,Real Estate Investment Trusts
EGY,VAALCO Energy Inc.  Common Stock,$2.99,0.07,2.397%,171793856.00,United States,,587991,Energy,Oil & Gas Production
EHC,Encompass Health Corporation Common Stock,$82.25,-1.07,-1.284%,8178320164.00,United States,,656883,Health Care,Hospital/Nursing Management
EHI,Western Asset Global High Income Fund Inc Common Stock,$10.15,-0.25,-2.404%,230377565.00,United States,2003,131490,,
EHT,Eaton Vance 2021 Target Term Trust Common Shares of Beneficial Interest,$9.84,0.03,0.306%,211210719.00,United States,2016,96860,,
EIC,Eagle Point Income Company Inc. Common Stock,$15.18,-0.06,-0.394%,0.00,,2019,6239,,
